{
  "$schema": "http://json-schema.org/schema#",
  "type": "object",
  "properties": {
    "id": {
      "type": "integer"
    },
    "name": {
      "type": "string"
    },
    "official": {
      "type": "boolean"
    },
    "iso639": {
      "type": "string"
    },
    "iso3166": {
      "type": "string"
    },
    "names": {
      "type": "array",
      "items": {
        "$ref": "/schema/v2/name.json"
      }
    }
  },
  "required": [
    "id",
    "iso3166",
    "iso639",
    "name",
    "names",
    "official"
  ]
}