{
  "id": 10,
  "name": "cs",
  "official": false,
  "iso639": "cs",
  "iso3166": "cz",
  "names": [
    {
      "name": "チェコ語",
      "language": {
        "name": "ja-hrkt",
        "url": "/api/v2/language/1/"
      }
    },
    {
      "name": "체코어",
      "language": {
        "name": "ko",
        "url": "/api/v2/language/3/"
      }
    },
    {
      "name": "Tchèque",
      "language": {
        "name": "fr",
        "url": "/api/v2/language/5/"
      }
    },
    {
      "name": "Tschechisch",
      "language": {
        "name": "de",
        "url": "/api/v2/language/6/"
      }
    },
    {
      "name": "Checo",
      "language": {
        "name": "es",
        "url": "/api/v2/language/7/"
      }
    },
    {
      "name": "Ceco",
      "language": {
        "name": "it",
        "url": "/api/v2/language/8/"
      }
    },
    {
      "name": "Czech",
      "language": {
        "name": "en",
        "url": "/api/v2/language/9/"
      }
    },
    {
      "name": "Tcheco",
      "language": {
        "name": "pt-br",
        "url": "/api/v2/language/13/"
      }
    },
    {
      "name": "Checo",
      "language": {
        "name": "es-419",
        "url": "/api/v2/language/14/"
      }
    }
  ]
}