{
  "id": 9,
  "name": "en",
  "official": true,
  "iso639": "en",
  "iso3166": "us",
  "names": [
    {
      "name": "英語",
      "language": {
        "name": "ja-hrkt",
        "url": "/api/v2/language/1/"
      }
    },
    {
      "name": "영어",
      "language": {
        "name": "ko",
        "url": "/api/v2/language/3/"
      }
    },
    {
      "name": "Anglais",
      "language": {
        "name": "fr",
        "url": "/api/v2/language/5/"
      }
    },
    {
      "name": "Englisch",
      "language": {
        "name": "de",
        "url": "/api/v2/language/6/"
      }
    },
    {
      "name": "Inglés",
      "language": {
        "name": "es",
        "url": "/api/v2/language/7/"
      }
    },
    {
      "name": "Inglese",
      "language": {
        "name": "it",
        "url": "/api/v2/language/8/"
      }
    },
    {
      "name": "English",
      "language": {
        "name": "en",
        "url": "/api/v2/language/9/"
      }
    },
    {
      "name": "Inglês",
      "language": {
        "name": "pt-br",
        "url": "/api/v2/language/13/"
      }
    },
    {
      "name": "Inglés",
      "language": {
        "name": "es-419",
        "url": "/api/v2/language/14/"
      }
    }
  ]
}